<?xml version="1.0"?>
<xs:schema xmlns:xs="http://www.w3.org/2001/XMLSchema"
targetNamespace="http://www.w3schools.com"
xmlns="http://www.w3schools.com"
elementFormDefault="qualified">

  <xs:element name="Comments">
    <xs:complexType>
      <xs:sequence>
        <xs:element type="xs:string" name="CommentID"/>
        <xs:element type="xs:string" name="TimeStamp"/>
        <xs:element type="xs:string" name="CommentText"/>
        <xs:element type="xs:string" name="CommentType"/>
		<xs:element type="xs:string" name="CustomerID"/>
      </xs:sequence>
    </xs:complexType>
  </xs:element>
</xs:schema>